Diagnosis,Symptoms,MEDICATION,Specialty
"S04811S Injury of olfactory [1st ] nerve, right side, sequela",,,Neurology
"S04812A Injury of olfactory [1st ] nerve, left side, initial encounter",,,Neurology
"S04812D Injury of olfactory [1st ] nerve, left side, subsequent encounter",,,Neurology
"S04812S Injury of olfactory [1st ] nerve, left side, sequela",,,Neurology
"S04819A Injury of olfactory [1st ] nerve, unspecified side, initial encounter",,,Neurology
"S04819D Injury of olfactory [1st ] nerve, unspecified side, subsequent encounter",,,Neurology
"S04819S Injury of olfactory [1st ] nerve, unspecified side, sequela",,,Neurology
"S049XXA Injury of unspecified cranial nerve, initial encounter",,,Neurology
"S049XXD Injury of unspecified cranial nerve, subsequent encounter",,,Neurology
"S049XXS Injury of unspecified cranial nerve, sequela",,,Neurology
"S061X7A Traumatic cerebral edema with loss of consciousness of any duration with death due to brain
injury prior to regaining consciousness, initial encounter",,,Neurology
"S061X7D Traumatic cerebral edema with loss of consciousness of any duration with death due to brain
injury prior to regaining consciousness, subsequent encounter",,,Neurology
"S061X7S Traumatic cerebral edema with loss of consciousness of any duration with death due to brain
injury prior to regaining consciousness, sequela",,,Neurology
"S062X0A Diffuse traumatic brain injury without loss of consciousness, initial encounter",,,Neurology
"S062X0D Diffuse traumatic brain injury without loss of consciousness, subsequent encounter",,,Neurology
"S062X0S Diffuse traumatic brain injury without loss of consciousness, sequela",,,Neurology
"S062X1A Diffuse traumatic brain injury with loss of consciousness of 30 minutes or less, initial encounter",,,Neurology
"S062X1D Diffuse traumatic brain injury with loss of consciousness of 30 minutes or less, subsequent
encounter",,,Neurology
"S062X1S Diffuse traumatic brain injury with loss of consciousness of 30 minutes or less, sequela",,,Neurology
"S062X2A Diffuse traumatic brain injury with loss of consciousness of 31 minutes to 59 minutes, initial
encounter",,,Neurology
"S062X2D Diffuse traumatic brain injury with loss of consciousness of 31 minutes to 59 minutes,
subsequent encounter",,,Neurology
"S062X2S Diffuse traumatic brain injury with loss of consciousness of 31 minutes to 59 minutes, sequela",,,Neurology
"S062X3A Diffuse traumatic brain injury with loss of consciousness of 1 hour to 5 hours 59 minutes, initial
encounter",,,Neurology
"S062X3D Diffuse traumatic brain injury with loss of consciousness of 1 hour to 5 hours 59 minutes,
subsequent encounter",,,Neurology
"S062X3S Diffuse traumatic brain injury with loss of consciousness of 1 hour to 5 hours 59 minutes,
sequela",,,Neurology
"S062X4A Diffuse traumatic brain injury with loss of consciousness of 6 hours to 24 hours, initial
encounter",,,Neurology
"S062X4D Diffuse traumatic brain injury with loss of consciousness of 6 hours to 24 hours, subsequent
encounter",,,Neurology
"S062X4S Diffuse traumatic brain injury with loss of consciousness of 6 hours to 24 hours, sequela",,,Neurology
"S062X5A Diffuse traumatic brain injury with loss of consciousness greater than 24 hours with return to
pre-existing conscious levels, initial encounter",,,Neurology
"S062X5D Diffuse traumatic brain injury with loss of consciousness greater than 24 hours with return to
pre-existing conscious levels, subsequent encounter",,,Neurology
"S062X5S Diffuse traumatic brain injury with loss of consciousness greater than 24 hours with return to
pre-existing conscious levels, sequela",,,Neurology
"S062X6A Diffuse traumatic brain injury with loss of consciousness greater than 24 hours without return
to pre-existing conscious level with patient surviving, initial encounter",,,Neurology
"S062X6D Diffuse traumatic brain injury with loss of consciousness greater than 24 hours without return
to pre-existing conscious level with patient surviving, subsequent encounter",,,Neurology
"S062X6S Diffuse traumatic brain injury with loss of consciousness greater than 24 hours without return
to pre-existing conscious level with patient surviving, sequela",,,Neurology
"S062X7A Diffuse traumatic brain injury with loss of consciousness of any duration with death due to
brain injury prior to regaining consciousness, initial encounter",,,Neurology
"S062X7D Diffuse traumatic brain injury with loss of consciousness of any duration with death due to
brain injury prior to regaining consciousness, subsequent encounter",,,Neurology
"S062X7S Diffuse traumatic brain injury with loss of consciousness of any duration with death due to
brain injury prior to regaining consciousness, sequela",,,Neurology
"S062X8A Diffuse traumatic brain injury with loss of consciousness of any duration with death due to
other cause prior to regaining consciousness, initial encounter",,,Neurology
"S062X8D Diffuse traumatic brain injury with loss of consciousness of any duration with death due to
other cause prior to regaining consciousness, subsequent encounter",,,Neurology
"S062X8S Diffuse traumatic brain injury with loss of consciousness of any duration with death due to
other cause prior to regaining consciousness, sequela",,,Neurology
"S062X9A Diffuse traumatic brain injury with loss of consciousness of unspecified duration, initial
encounter",,,Neurology
"S062X9D Diffuse traumatic brain injury with loss of consciousness of unspecified duration, subsequent
encounter",,,Neurology
"S062X9S Diffuse traumatic brain injury with loss of consciousness of unspecified duration, sequela",,,Neurology
"S06300A Unspecified focal traumatic brain injury without loss of consciousness, initial encounter",,,Neurology
"S06300D Unspecified focal traumatic brain injury without loss of consciousness, subsequent encounter",,,Neurology
"S06300S Unspecified focal traumatic brain injury without loss of consciousness, sequela",,,Neurology
"S06301A Unspecified focal traumatic brain injury with loss of consciousness of 30 minutes or less, initial
encounter",,,Neurology
"S06301D Unspecified focal traumatic brain injury with loss of consciousness of 30 minutes or less,
subsequent encounter",,,Neurology
"S06301S Unspecified focal traumatic brain injury with loss of consciousness of 30 minutes or less,
sequela",,,Neurology
"S06302A Unspecified focal traumatic brain injury with loss of consciousness of 31 minutes to 59
minutes, initial encounter",,,Neurology
"S06302D Unspecified focal traumatic brain injury with loss of consciousness of 31 minutes to 59
minutes, subsequent encounter",,,Neurology
"S06302S Unspecified focal traumatic brain injury with loss of consciousness of 31 minutes to 59 minutes,
sequela",,,Neurology
"S06303A Unspecified focal traumatic brain injury with loss of consciousness of 1 hour to 5 hours 59
minutes, initial encounter",,,Neurology
"S06303D Unspecified focal traumatic brain injury with loss of consciousness of 1 hour to 5 hours 59
minutes, subsequent encounter",,,Neurology
"S06303S Unspecified focal traumatic brain injury with loss of consciousness of 1 hour to 5 hours 59
minutes, sequela",,,Neurology
"S06304A Unspecified focal traumatic brain injury with loss of consciousness of 6 hours to 24 hours,
initial encounter",,,Neurology
"S06304D Unspecified focal traumatic brain injury with loss of consciousness of 6 hours to 24 hours,
subsequent encounter",,,Neurology
"S06304S Unspecified focal traumatic brain injury with loss of consciousness of 6 hours to 24 hours,
sequela",,,Neurology
"S06305A Unspecified focal traumatic brain injury with loss of consciousness greater than 24 hours with
return to pre-existing conscious level, initial encounter",,,Neurology
"S06305D Unspecified focal traumatic brain injury with loss of consciousness greater than 24 hours with
return to pre-existing conscious level, subsequent encounter",,,Neurology
"S06305S Unspecified focal traumatic brain injury with loss of consciousness greater than 24 hours with
return to pre-existing conscious level, sequela",,,Neurology
"S06306A Unspecified focal traumatic brain injury with loss of consciousness greater than 24 hours
without return to pre-existing conscious level with patient surviving, initial encounter",,,Neurology
"S06306D Unspecified focal traumatic brain injury with loss of consciousness greater than 24 hours
without return to pre-existing conscious level with patient surviving, subsequent encounter",,,Neurology
"S06306S Unspecified focal traumatic brain injury with loss of consciousness greater than 24 hours
without return to pre-existing conscious level with patient surviving, sequela",,,Neurology
"S06307A Unspecified focal traumatic brain injury with loss of consciousness of any duration with death
due to brain injury prior to regaining consciousness, initial encounter",,,Neurology
"S06307D Unspecified focal traumatic brain injury with loss of consciousness of any duration with death
due to brain injury prior to regaining consciousness, subsequent encounter",,,Neurology
"S06307S Unspecified focal traumatic brain injury with loss of consciousness of any duration with death
due to brain injury prior to regaining consciousness, sequela",,,Neurology
"S06308A Unspecified focal traumatic brain injury with loss of consciousness of any duration with death
due to other cause prior to regaining consciousness, initial encounter",,,Neurology
"S06308D Unspecified focal traumatic brain injury with loss of consciousness of any duration with death
due to other cause prior to regaining consciousness, subsequent encounter",,,Neurology
"S06308S Unspecified focal traumatic brain injury with loss of consciousness of any duration with death
due to other cause prior to regaining consciousness, sequela",,,Neurology
"S06309A Unspecified focal traumatic brain injury with loss of consciousness of unspecified duration,
initial encounter",,,Neurology
"S06309D Unspecified focal traumatic brain injury with loss of consciousness of unspecified duration,
subsequent encounter",,,Neurology
"S06309S Unspecified focal traumatic brain injury with loss of consciousness of unspecified duration,
sequela",,,Neurology
"S06317A Contusion and laceration of right cerebrum with loss of consciousness of any duration with
death due to brain injury prior to regaining consciousness, initial encounter",,,Neurology
"S06317D Contusion and laceration of right cerebrum with loss of consciousness of any duration with
death due to brain injury prior to regaining consciousness, subsequent encounter",,,Neurology
"S06317S Contusion and laceration of right cerebrum with loss of consciousness of any duration with
death due to brain injury prior to regaining consciousness, sequela",,,Neurology
"S06327A Contusion and laceration of left cerebrum with loss of consciousness of any duration with
death due to brain injury prior to regaining consciousness, initial encounter",,,Neurology
"S06327D Contusion and laceration of left cerebrum with loss of consciousness of any duration with
death due to brain injury prior to regaining consciousness, subsequent encounter",,,Neurology
"S06327S Contusion and laceration of left cerebrum with loss of consciousness of any duration with
death due to brain injury prior to regaining consciousness, sequela",,,Neurology
"S06337A Contusion and laceration of cerebrum, unspecified, with loss of consciousness of any duration
with death due to brain injury prior to regaining consciousness, initial encounter",,,Neurology
"S06337D Contusion and laceration of cerebrum, unspecified, with loss of consciousness of any duration
with death due to brain injury prior to regaining consciousness, subsequent encounter",,,Neurology
"S06337S Contusion and laceration of cerebrum, unspecified, with loss of consciousness of any duration
with death due to brain injury prior to regaining consciousness, sequela",,,Neurology
"S06347A Traumatic hemorrhage of right cerebrum with loss of consciousness of any duration with death
due to brain injury prior to regaining consciousness, initial encounter",,,Neurology
"S06347D Traumatic hemorrhage of right cerebrum with loss of consciousness of any duration with death
due to brain injury prior to regaining consciousness, subsequent encounter",,,Neurology
"S06347S Traumatic hemorrhage of right cerebrum with loss of consciousness of any duration with death
due to brain injury prior to regaining consciousness, sequela",,,Neurology
"S06357A Traumatic hemorrhage of left cerebrum with loss of consciousness of any duration with death
due to brain injury prior to regaining consciousness, initial encounter",,,Neurology
"S06357D Traumatic hemorrhage of left cerebrum with loss of consciousness of any duration with death
due to brain injury prior to regaining consciousness, subsequent encounter",,,Neurology
"S06357S Traumatic hemorrhage of left cerebrum with loss of consciousness of any duration with death
due to brain injury prior to regaining consciousness, sequela",,,Neurology
"S06367A Traumatic hemorrhage of cerebrum, unspecified, with loss of consciousness of any duration
with death due to brain injury prior to regaining consciousness, initial encounter",,,Neurology
"S06367D Traumatic hemorrhage of cerebrum, unspecified, with loss of consciousness of any duration
with death due to brain injury prior to regaining consciousness, subsequent encounter",,,Neurology
"S06367S Traumatic hemorrhage of cerebrum, unspecified, with loss of consciousness of any duration
with death due to brain injury prior to regaining consciousness, sequela",,,Neurology
"S06377A Contusion, laceration, and hemorrhage of cerebellum with loss of consciousness of any
duration with death due to brain injury prior to regaining consciousness, initial encounter",,,Neurology
"S06377D Contusion, laceration, and hemorrhage of cerebellum with loss of consciousness of any
duration with death due to brain injury prior to regaining consciousness, subsequent encounter",,,Neurology
"S06377S Contusion, laceration, and hemorrhage of cerebellum with loss of consciousness of any
duration with death due to brain injury prior to regaining consciousness, sequela",,,Neurology
"S06387A Contusion, laceration, and hemorrhage of brainstem with loss of consciousness of any duration
with death due to brain injury prior to regaining consciousness, initial encounter",,,Neurology
"S06387D Contusion, laceration, and hemorrhage of brainstem with loss of consciousness of any duration
with death due to brain injury prior to regaining consciousness, subsequent encounter",,,Neurology
"S06387S Contusion, laceration, and hemorrhage of brainstem with loss of consciousness of any duration
with death due to brain injury prior to regaining consciousness, sequela",,,Neurology
"S064X7A Epidural hemorrhage with loss of consciousness of any duration with death due to brain injury
prior to regaining consciousness, initial encounter",,,Neurology
"S064X7D Epidural hemorrhage with loss of consciousness of any duration with death due to brain injury
prior to regaining consciousness, subsequent encounter",,,Neurology
"S064X7S Epidural hemorrhage with loss of consciousness of any duration with death due to brain injury
prior to regaining consciousness, sequela",,,Neurology
"S065X7A Traumatic subdural hemorrhage with loss of consciousness of any duration with death due to
brain injury before regaining consciousness, initial encounter",,,Neurology
"S065X7D Traumatic subdural hemorrhage with loss of consciousness of any duration with death due to
brain injury before regaining consciousness, subsequent encounter",,,Neurology
"S065X7S Traumatic subdural hemorrhage with loss of consciousness of any duration with death due to
brain injury before regaining consciousness, sequela",,,Neurology
"S066X7A Traumatic subarachnoid hemorrhage with loss of consciousness of any duration with death
due to brain injury prior to regaining consciousness, initial encounter",,,Neurology
"S066X7D Traumatic subarachnoid hemorrhage with loss of consciousness of any duration with death
due to brain injury prior to regaining consciousness, subsequent encounter",,,Neurology
"S066X7S Traumatic subarachnoid hemorrhage with loss of consciousness of any duration with death due
to brain injury prior to regaining consciousness, sequela",,,Neurology
"S06817A Injury of right internal carotid artery, intracranial portion, not elsewhere classified with loss of consciousness of any duration with death due to brain injury prior to regaining consciousness, initial encounter",,,Neurology
"S06817D Injury of right internal carotid artery, intracranial portion, not elsewhere classified with loss of consciousness of any duration with death due to brain injury prior to regaining consciousness, subsequent encounter",,,Neurology
"S06817S Injury of right internal carotid artery, intracranial portion, not elsewhere classified with loss of
consciousness of any duration with death due to brain injury prior to regaining consciousness, sequela",,,Neurology
"S06827A Injury of left internal carotid artery, intracranial portion, not elsewhere classified with loss of consciousness of any duration with death due to brain injury prior to regaining consciousness, initial encounter",,,Neurology
"S06827D Injury of left internal carotid artery, intracranial portion, not elsewhere classified with loss of consciousness of any duration with death due to brain injury prior to regaining consciousness, subsequent encounter",,,Neurology
"S06827S Injury of left internal carotid artery, intracranial portion, not elsewhere classified with loss of
consciousness of any duration with death due to brain injury prior to regaining consciousness, sequela",,,Neurology
"S06897A Other specified intracranial injury with loss of consciousness of any duration with death due to
brain injury prior to regaining consciousness, initial encounter",,,Neurology
"S06897D Other specified intracranial injury with loss of consciousness of any duration with death due to
brain injury prior to regaining consciousness, subsequent encounter",,,Neurology
"S06897S Other specified intracranial injury with loss of consciousness of any duration with death due to
brain injury prior to regaining consciousness, sequela",,,Neurology
"S069X7A Unspecified intracranial injury with loss of consciousness of any duration with death due to
brain injury prior to regaining consciousness, initial encounter",,,Neurology
"S069X7D Unspecified intracranial injury with loss of consciousness of any duration with death due to
brain injury prior to regaining consciousness, subsequent encounter",,,Neurology
"S069X7S Unspecified intracranial injury with loss of consciousness of any duration with death due to
brain injury prior to regaining consciousness, sequela",,,Neurology
"S142XXA Injury of nerve root of cervical spine, initial encounter",,,Neurology
"S142XXD Injury of nerve root of cervical spine, subsequent encounter",,,Neurology
"S142XXS Injury of nerve root of cervical spine, sequela",,,Neurology
"S242XXA Injury of nerve root of thoracic spine, initial encounter",,,Neurology
"S242XXD Injury of nerve root of thoracic spine, subsequent encounter",,,Neurology
"S242XXS Injury of nerve root of thoracic spine, sequela",,,Neurology
"S249XXA Injury of unspecified nerve of thorax, initial encounter",,,Neurology
"S249XXD Injury of unspecified nerve of thorax, subsequent encounter",,,Neurology
"S249XXS Injury of unspecified nerve of thorax, sequela",,,Neurology
"S3421XA Injury of nerve root of lumbar spine, initial encounter",,,Neurology
"S3421XD Injury of nerve root of lumbar spine, subsequent encounter",,,Neurology
"S3421XS Injury of nerve root of lumbar spine, sequela",,,Neurology
"S3422XA Injury of nerve root of sacral spine, initial encounter",,,Neurology
"S3422XD Injury of nerve root of sacral spine, subsequent encounter",,,Neurology
"S3422XS Injury of nerve root of sacral spine, sequela",,,Neurology
"S346XXA Injury of peripheral nerve(s) at abdomen, lower back and pelvis level, initial encounter",,,Neurology
"S346XXD Injury of peripheral nerve(s) at abdomen, lower back and pelvis level, subsequent encounter",,,Neurology
"S346XXS Injury of peripheral nerve(s) at abdomen, lower back and pelvis level, sequela",,,Neurology
"S4400XA Injury of ulnar nerve at upper arm level, unspecified arm, initial encounter",,,Neurology
"S4400XD Injury of ulnar nerve at upper arm level, unspecified arm, subsequent encounter",,,Neurology
"S4400XS Injury of ulnar nerve at upper arm level, unspecified arm, sequela",,,Neurology
"S4401XA Injury of ulnar nerve at upper arm level, right arm, initial encounter",,,Neurology
"S4401XD Injury of ulnar nerve at upper arm level, right arm, subsequent encounter",,,Neurology
"S4401XS Injury of ulnar nerve at upper arm level, right arm, sequela",,,Neurology
"S4402XA Injury of ulnar nerve at upper arm level, left arm, initial encounter",,,Neurology
"S4402XD Injury of ulnar nerve at upper arm level, left arm, subsequent encounter",,,Neurology
"S4402XS Injury of ulnar nerve at upper arm level, left arm, sequela",,,Neurology
"S4410XA Injury of median nerve at upper arm level, unspecified arm, initial encounter",,,Neurology
"S4410XD Injury of median nerve at upper arm level, unspecified arm, subsequent encounter",,,Neurology
"S4410XS Injury of median nerve at upper arm level, unspecified arm, sequela",,,Neurology
"S4411XA Injury of median nerve at upper arm level, right arm, initial encounter",,,Neurology
"S4411XD Injury of median nerve at upper arm level, right arm, subsequent encounter",,,Neurology
"S4411XS Injury of median nerve at upper arm level, right arm, sequela",,,Neurology
"S4412XA Injury of median nerve at upper arm level, left arm, initial encounter",,,Neurology
"S4412XD Injury of median nerve at upper arm level, left arm, subsequent encounter",,,Neurology
"S4412XS Injury of median nerve at upper arm level, left arm, sequela",,,Neurology
"S4420XA Injury of radial nerve at upper arm level, unspecified arm, initial encounter",,,Neurology
"S4420XD Injury of radial nerve at upper arm level, unspecified arm, subsequent encounter",,,Neurology
"S4420XS Injury of radial nerve at upper arm level, unspecified arm, sequela",,,Neurology
"S4421XA Injury of radial nerve at upper arm level, right arm, initial encounter",,,Neurology
"S4421XD Injury of radial nerve at upper arm level, right arm, subsequent encounter",,,Neurology
"S4421XS Injury of radial nerve at upper arm level, right arm, sequela",,,Neurology
"S4422XA Injury of radial nerve at upper arm level, left arm, initial encounter",,,Neurology
"S4422XD Injury of radial nerve at upper arm level, left arm, subsequent encounter",,,Neurology
"S4422XS Injury of radial nerve at upper arm level, left arm, sequela",,,Neurology
"S4430XA Injury of axillary nerve, unspecified arm, initial encounter",,,Neurology
"S4430XD Injury of axillary nerve, unspecified arm, subsequent encounter",,,Neurology
"S4430XS Injury of axillary nerve, unspecified arm, sequela",,,Neurology
"S4431XA Injury of axillary nerve, right arm, initial encounter",,,Neurology
"S4431XD Injury of axillary nerve, right arm, subsequent encounter",,,Neurology
"S4431XS Injury of axillary nerve, right arm, sequela",,,Neurology
"S4432XA Injury of axillary nerve, left arm, initial encounter",,,Neurology
"S4432XD Injury of axillary nerve, left arm, subsequent encounter",,,Neurology
"S4432XS Injury of axillary nerve, left arm, sequela",,,Neurology
"S4440XA Injury of musculocutaneous nerve, unspecified arm, initial encounter",,,Neurology
"S4440XD Injury of musculocutaneous nerve, unspecified arm, subsequent encounter",,,Neurology
"S4440XS Injury of musculocutaneous nerve, unspecified arm, sequela",,,Neurology
"S4441XA Injury of musculocutaneous nerve, right arm, initial encounter",,,Neurology
"S4441XD Injury of musculocutaneous nerve, right arm, subsequent encounter",,,Neurology
"S4441XS Injury of musculocutaneous nerve, right arm, sequela",,,Neurology
"S4442XA Injury of musculocutaneous nerve, left arm, initial encounter",,,Neurology
"S4442XD Injury of musculocutaneous nerve, left arm, subsequent encounter",,,Neurology
"S4442XS Injury of musculocutaneous nerve, left arm, sequela",,,Neurology
"S4450XA Injury of cutaneous sensory nerve at shoulder and upper arm level, unspecified arm, initial
encounter",,,Neurology
"S4450XD Injury of cutaneous sensory nerve at shoulder and upper arm level, unspecified arm,
subsequent encounter",,,Neurology
"S4450XS Injury of cutaneous sensory nerve at shoulder and upper arm level, unspecified arm, sequela",,,Neurology
"S4451XA Injury of cutaneous sensory nerve at shoulder and upper arm level, right arm, initial encounter",,,Neurology
"S4451XD Injury of cutaneous sensory nerve at shoulder and upper arm level, right arm, subsequent
encounter",,,Neurology
"S4451XS Injury of cutaneous sensory nerve at shoulder and upper arm level, right arm, sequela",,,Neurology
"S4452XA Injury of cutaneous sensory nerve at shoulder and upper arm level, left arm, initial encounter",,,Neurology
"S4452XD Injury of cutaneous sensory nerve at shoulder and upper arm level, left arm, subsequent
encounter",,,Neurology
"S4452XS Injury of cutaneous sensory nerve at shoulder and upper arm level, left arm, sequela",,,Neurology
"S4490XA Injury of unspecified nerve at shoulder and upper arm level, unspecified arm, initial encounter",,,Neurology
"S4490XD Injury of unspecified nerve at shoulder and upper arm level, unspecified arm, subsequent
encounter",,,Neurology
"S4490XS Injury of unspecified nerve at shoulder and upper arm level, unspecified arm, sequela",,,Neurology
"S4491XA Injury of unspecified nerve at shoulder and upper arm level, right arm, initial encounter",,,Neurology
"S4491XD Injury of unspecified nerve at shoulder and upper arm level, right arm, subsequent encounter",,,Neurology
"S4491XS Injury of unspecified nerve at shoulder and upper arm level, right arm, sequela",,,Neurology
