Diagnosis,Symptoms,MEDICATION,Specialty
"T85732A Infection and inflammatory reaction due to implanted electronic neurostimulator of peripheral
nerve, electrode (lead), initial encounter",,,Neurology
"T85732D Infection and inflammatory reaction due to implanted electronic neurostimulator of peripheral
nerve, electrode (lead), subsequent encounter",,,Neurology
"T85732S Infection and inflammatory reaction due to implanted electronic neurostimulator of peripheral
nerve, electrode (lead), sequela",,,Neurology
Z13850  Encounter for screening for traumatic brain injury,,,Neurology
"Z4542   Encounter for adjustment and management of neuropacemaker (brain) (peripheral nerve)
(spinal cord)",,,Neurology
Z820    Family history of epilepsy and other diseases of the nervous system,,,Neurology
Z823    Family history of stroke,,,Neurology
Z85841  Personal history of malignant neoplasm of brain,,,Neurology
Z86011  Personal history of benign neoplasm of the brain,,,Neurology
Z87820  Personal history of traumatic brain injury,,,Neurology
