Diagnosis,Symptoms,MEDICATION,Specialty
"S4492XA Injury of unspecified nerve at shoulder and upper arm level, left arm, initial encounter",,,Neurology
"S4492XD Injury of unspecified nerve at shoulder and upper arm level, left arm, subsequent encounter",,,Neurology
"S4492XS Injury of unspecified nerve at shoulder and upper arm level, left arm, sequela",,,Neurology
"S5400XA Injury of ulnar nerve at forearm level, unspecified arm, initial encounter",,,Neurology
"S5400XD Injury of ulnar nerve at forearm level, unspecified arm, subsequent encounter",,,Neurology
"S5400XS Injury of ulnar nerve at forearm level, unspecified arm, sequela",,,Neurology
"S5401XA Injury of ulnar nerve at forearm level, right arm, initial encounter",,,Neurology
"S5401XD Injury of ulnar nerve at forearm level, right arm, subsequent encounter",,,Neurology
"S5401XS Injury of ulnar nerve at forearm level, right arm, sequela",,,Neurology
"S5402XA Injury of ulnar nerve at forearm level, left arm, initial encounter",,,Neurology
"S5402XD Injury of ulnar nerve at forearm level, left arm, subsequent encounter",,,Neurology
"S5402XS Injury of ulnar nerve at forearm level, left arm, sequela",,,Neurology
"S5410XA Injury of median nerve at forearm level, unspecified arm, initial encounter",,,Neurology
"S5410XD Injury of median nerve at forearm level, unspecified arm, subsequent encounter",,,Neurology
"S5410XS Injury of median nerve at forearm level, unspecified arm, sequela",,,Neurology
"S5411XA Injury of median nerve at forearm level, right arm, initial encounter",,,Neurology
"S5411XD Injury of median nerve at forearm level, right arm, subsequent encounter",,,Neurology
"S5411XS Injury of median nerve at forearm level, right arm, sequela",,,Neurology
"S5412XA Injury of median nerve at forearm level, left arm, initial encounter",,,Neurology
"S5412XD Injury of median nerve at forearm level, left arm, subsequent encounter",,,Neurology
"S5412XS Injury of median nerve at forearm level, left arm, sequela",,,Neurology
"S5420XA Injury of radial nerve at forearm level, unspecified arm, initial encounter",,,Neurology
"S5420XD Injury of radial nerve at forearm level, unspecified arm, subsequent encounter",,,Neurology
"S5420XS Injury of radial nerve at forearm level, unspecified arm, sequela",,,Neurology
"S5421XA Injury of radial nerve at forearm level, right arm, initial encounter",,,Neurology
"S5421XD Injury of radial nerve at forearm level, right arm, subsequent encounter",,,Neurology
"S5421XS Injury of radial nerve at forearm level, right arm, sequela",,,Neurology
"S5422XA Injury of radial nerve at forearm level, left arm, initial encounter",,,Neurology
"S5422XD Injury of radial nerve at forearm level, left arm, subsequent encounter",,,Neurology
"S5422XS Injury of radial nerve at forearm level, left arm, sequela",,,Neurology
"S5430XA Injury of cutaneous sensory nerve at forearm level, unspecified arm, initial encounter",,,Neurology
"S5430XD Injury of cutaneous sensory nerve at forearm level, unspecified arm, subsequent encounter",,,Neurology
"S5430XS Injury of cutaneous sensory nerve at forearm level, unspecified arm, sequela",,,Neurology
"S5431XA Injury of cutaneous sensory nerve at forearm level, right arm, initial encounter",,,Neurology
"S5431XD Injury of cutaneous sensory nerve at forearm level, right arm, subsequent encounter",,,Neurology
"S5431XS Injury of cutaneous sensory nerve at forearm level, right arm, sequela",,,Neurology
"S5432XA Injury of cutaneous sensory nerve at forearm level, left arm, initial encounter",,,Neurology
"S5432XD Injury of cutaneous sensory nerve at forearm level, left arm, subsequent encounter",,,Neurology
"S5432XS Injury of cutaneous sensory nerve at forearm level, left arm, sequela",,,Neurology
"S5490XA Injury of unspecified nerve at forearm level, unspecified arm, initial encounter",,,Neurology
"S5490XD Injury of unspecified nerve at forearm level, unspecified arm, subsequent encounter",,,Neurology
"S5490XS Injury of unspecified nerve at forearm level, unspecified arm, sequela",,,Neurology
"S5491XA Injury of unspecified nerve at forearm level, right arm, initial encounter",,,Neurology
"S5491XD Injury of unspecified nerve at forearm level, right arm, subsequent encounter",,,Neurology
"S5491XS Injury of unspecified nerve at forearm level, right arm, sequela",,,Neurology
"S5492XA Injury of unspecified nerve at forearm level, left arm, initial encounter",,,Neurology
"S5492XD Injury of unspecified nerve at forearm level, left arm, subsequent encounter",,,Neurology
"S5492XS Injury of unspecified nerve at forearm level, left arm, sequela",,,Neurology
"S6400XA Injury of ulnar nerve at wrist and hand level of unspecified arm, initial encounter",,,Neurology
"S6400XD Injury of ulnar nerve at wrist and hand level of unspecified arm, subsequent encounter",,,Neurology
"S6400XS Injury of ulnar nerve at wrist and hand level of unspecified arm, sequela",,,Neurology
"S6401XA Injury of ulnar nerve at wrist and hand level of right arm, initial encounter",,,Neurology
"S6401XD Injury of ulnar nerve at wrist and hand level of right arm, subsequent encounter",,,Neurology
"S6401XS Injury of ulnar nerve at wrist and hand level of right arm, sequela",,,Neurology
"S6402XA Injury of ulnar nerve at wrist and hand level of left arm, initial encounter",,,Neurology
"S6402XD Injury of ulnar nerve at wrist and hand level of left arm, subsequent encounter",,,Neurology
"S6402XS Injury of ulnar nerve at wrist and hand level of left arm, sequela",,,Neurology
"S6410XA Injury of median nerve at wrist and hand level of unspecified arm, initial encounter",,,Neurology
"S6410XD Injury of median nerve at wrist and hand level of unspecified arm, subsequent encounter",,,Neurology
"S6410XS Injury of median nerve at wrist and hand level of unspecified arm, sequela",,,Neurology
"S6411XA Injury of median nerve at wrist and hand level of right arm, initial encounter",,,Neurology
"S6411XD Injury of median nerve at wrist and hand level of right arm, subsequent encounter",,,Neurology
"S6411XS Injury of median nerve at wrist and hand level of right arm, sequela",,,Neurology
"S6412XA Injury of median nerve at wrist and hand level of left arm, initial encounter",,,Neurology
"S6412XD Injury of median nerve at wrist and hand level of left arm, subsequent encounter",,,Neurology
"S6412XS Injury of median nerve at wrist and hand level of left arm, sequela",,,Neurology
"S6420XA Injury of radial nerve at wrist and hand level of unspecified arm, initial encounter",,,Neurology
"S6420XD Injury of radial nerve at wrist and hand level of unspecified arm, subsequent encounter",,,Neurology
"S6420XS Injury of radial nerve at wrist and hand level of unspecified arm, sequela",,,Neurology
"S6421XA Injury of radial nerve at wrist and hand level of right arm, initial encounter",,,Neurology
"S6421XD Injury of radial nerve at wrist and hand level of right arm, subsequent encounter",,,Neurology
"S6421XS Injury of radial nerve at wrist and hand level of right arm, sequela",,,Neurology
"S6422XA Injury of radial nerve at wrist and hand level of left arm, initial encounter",,,Neurology
"S6422XD Injury of radial nerve at wrist and hand level of left arm, subsequent encounter",,,Neurology
"S6422XS Injury of radial nerve at wrist and hand level of left arm, sequela",,,Neurology
"S6430XA Injury of digital nerve of unspecified thumb, initial encounter",,,Neurology
"S6430XD Injury of digital nerve of unspecified thumb, subsequent encounter",,,Neurology
"S6430XS Injury of digital nerve of unspecified thumb, sequela",,,Neurology
"S6431XA Injury of digital nerve of right thumb, initial encounter",,,Neurology
"S6431XD Injury of digital nerve of right thumb, subsequent encounter",,,Neurology
"S6431XS Injury of digital nerve of right thumb, sequela",,,Neurology
"S6432XA Injury of digital nerve of left thumb, initial encounter",,,Neurology
"S6432XD Injury of digital nerve of left thumb, subsequent encounter",,,Neurology
"S6432XS Injury of digital nerve of left thumb, sequela",,,Neurology
"S6440XA Injury of digital nerve of unspecified finger, initial encounter",,,Neurology
"S6440XD Injury of digital nerve of unspecified finger, subsequent encounter",,,Neurology
"S6440XS Injury of digital nerve of unspecified finger, sequela",,,Neurology
"S64490A Injury of digital nerve of right index finger, initial encounter",,,Neurology
"S64490D Injury of digital nerve of right index finger, subsequent encounter",,,Neurology
"S64490S Injury of digital nerve of right index finger, sequela",,,Neurology
"S64491A Injury of digital nerve of left index finger, initial encounter",,,Neurology
"S64491D Injury of digital nerve of left index finger, subsequent encounter",,,Neurology
"S64491S Injury of digital nerve of left index finger, sequela",,,Neurology
"S64492A Injury of digital nerve of right middle finger, initial encounter",,,Neurology
"S64492D Injury of digital nerve of right middle finger, subsequent encounter",,,Neurology
"S64492S Injury of digital nerve of right middle finger, sequela",,,Neurology
"S64493A Injury of digital nerve of left middle finger, initial encounter",,,Neurology
"S64493D Injury of digital nerve of left middle finger, subsequent encounter",,,Neurology
"S64493S Injury of digital nerve of left middle finger, sequela",,,Neurology
"S64494A Injury of digital nerve of right ring finger, initial encounter",,,Neurology
"S64494D Injury of digital nerve of right ring finger, subsequent encounter",,,Neurology
"S64494S Injury of digital nerve of right ring finger, sequela",,,Neurology
"S64495A Injury of digital nerve of left ring finger, initial encounter",,,Neurology
"S64495D Injury of digital nerve of left ring finger, subsequent encounter",,,Neurology
"S64495S Injury of digital nerve of left ring finger, sequela",,,Neurology
"S64496A Injury of digital nerve of right little finger, initial encounter",,,Neurology
"S64496D Injury of digital nerve of right little finger, subsequent encounter",,,Neurology
"S64496S Injury of digital nerve of right little finger, sequela",,,Neurology
"S64497A Injury of digital nerve of left little finger, initial encounter",,,Neurology
"S64497D Injury of digital nerve of left little finger, subsequent encounter",,,Neurology
"S64497S Injury of digital nerve of left little finger, sequela",,,Neurology
"S64498A Injury of digital nerve of other finger, initial encounter",,,Neurology
"S64498D Injury of digital nerve of other finger, subsequent encounter",,,Neurology
"S64498S Injury of digital nerve of other finger, sequela",,,Neurology
"S6490XA Injury of unspecified nerve at wrist and hand level of unspecified arm, initial encounter",,,Neurology
"S6490XD Injury of unspecified nerve at wrist and hand level of unspecified arm, subsequent encounter",,,Neurology
"S6490XS Injury of unspecified nerve at wrist and hand level of unspecified arm, sequela",,,Neurology
"S6491XA Injury of unspecified nerve at wrist and hand level of right arm, initial encounter",,,Neurology
"S6491XD Injury of unspecified nerve at wrist and hand level of right arm, subsequent encounter",,,Neurology
"S6491XS Injury of unspecified nerve at wrist and hand level of right arm, sequela",,,Neurology
"S6492XA Injury of unspecified nerve at wrist and hand level of left arm, initial encounter",,,Neurology
"S6492XD Injury of unspecified nerve at wrist and hand level of left arm, subsequent encounter",,,Neurology
"S6492XS Injury of unspecified nerve at wrist and hand level of left arm, sequela",,,Neurology
"S7400XA Injury of sciatic nerve at hip and thigh level, unspecified leg, initial encounter",,,Neurology
"S7400XD Injury of sciatic nerve at hip and thigh level, unspecified leg, subsequent encounter",,,Neurology
"S7400XS Injury of sciatic nerve at hip and thigh level, unspecified leg, sequela",,,Neurology
"S7401XA Injury of sciatic nerve at hip and thigh level, right leg, initial encounter",,,Neurology
"S7401XD Injury of sciatic nerve at hip and thigh level, right leg, subsequent encounter",,,Neurology
"S7401XS Injury of sciatic nerve at hip and thigh level, right leg, sequela",,,Neurology
"S7402XA Injury of sciatic nerve at hip and thigh level, left leg, initial encounter",,,Neurology
"S7402XD Injury of sciatic nerve at hip and thigh level, left leg, subsequent encounter",,,Neurology
"S7402XS Injury of sciatic nerve at hip and thigh level, left leg, sequela",,,Neurology
"S7410XA Injury of femoral nerve at hip and thigh level, unspecified leg, initial encounter",,,Neurology
"S7410XD Injury of femoral nerve at hip and thigh level, unspecified leg, subsequent encounter",,,Neurology
"S7410XS Injury of femoral nerve at hip and thigh level, unspecified leg, sequela",,,Neurology
"S7411XA Injury of femoral nerve at hip and thigh level, right leg, initial encounter",,,Neurology
"S7411XD Injury of femoral nerve at hip and thigh level, right leg, subsequent encounter",,,Neurology
"S7411XS Injury of femoral nerve at hip and thigh level, right leg, sequela",,,Neurology
"S7412XA Injury of femoral nerve at hip and thigh level, left leg, initial encounter",,,Neurology
"S7412XD Injury of femoral nerve at hip and thigh level, left leg, subsequent encounter",,,Neurology
"S7412XS Injury of femoral nerve at hip and thigh level, left leg, sequela",,,Neurology
"S7420XA Injury of cutaneous sensory nerve at hip and thigh level, unspecified leg, initial encounter",,,Neurology
"S7420XD Injury of cutaneous sensory nerve at hip and thigh level, unspecified leg, subsequent
encounter",,,Neurology
"S7420XS Injury of cutaneous sensory nerve at hip and thigh level, unspecified leg, sequela",,,Neurology
"S7421XA Injury of cutaneous sensory nerve at hip and high level, right leg, initial encounter",,,Neurology
"S7421XD Injury of cutaneous sensory nerve at hip and high level, right leg, subsequent encounter",,,Neurology
"S7421XS Injury of cutaneous sensory nerve at hip and high level, right leg, sequela",,,Neurology
"S7422XA Injury of cutaneous sensory nerve at hip and thigh level, left leg, initial encounter",,,Neurology
"S7422XD Injury of cutaneous sensory nerve at hip and thigh level, left leg, subsequent encounter",,,Neurology
"S7422XS Injury of cutaneous sensory nerve at hip and thigh level, left leg, sequela",,,Neurology
"S7490XA Injury of unspecified nerve at hip and thigh level, unspecified leg, initial encounter",,,Neurology
"S7490XD Injury of unspecified nerve at hip and thigh level, unspecified leg, subsequent encounter",,,Neurology
"S7490XS Injury of unspecified nerve at hip and thigh level, unspecified leg, sequela",,,Neurology
"S7491XA Injury of unspecified nerve at hip and thigh level, right leg, initial encounter",,,Neurology
"S7491XD Injury of unspecified nerve at hip and thigh level, right leg, subsequent encounter",,,Neurology
"S7491XS Injury of unspecified nerve at hip and thigh level, right leg, sequela",,,Neurology
"S7492XA Injury of unspecified nerve at hip and thigh level, left leg, initial encounter",,,Neurology
"S7492XD Injury of unspecified nerve at hip and thigh level, left leg, subsequent encounter",,,Neurology
"S7492XS Injury of unspecified nerve at hip and thigh level, left leg, sequela",,,Neurology
"S8400XA Injury of tibial nerve at lower leg level, unspecified leg, initial encounter",,,Neurology
"S8400XD Injury of tibial nerve at lower leg level, unspecified leg, subsequent encounter",,,Neurology
"S8400XS Injury of tibial nerve at lower leg level, unspecified leg, sequela",,,Neurology
"S8401XA Injury of tibial nerve at lower leg level, right leg, initial encounter",,,Neurology
"S8401XD Injury of tibial nerve at lower leg level, right leg, subsequent encounter",,,Neurology
"S8401XS Injury of tibial nerve at lower leg level, right leg, sequela",,,Neurology
"S8402XA Injury of tibial nerve at lower leg level, left leg, initial encounter",,,Neurology
"S8402XD Injury of tibial nerve at lower leg level, left leg, subsequent encounter",,,Neurology
"S8402XS Injury of tibial nerve at lower leg level, left leg, sequela",,,Neurology
"S8410XA Injury of peroneal nerve at lower leg level, unspecified leg, initial encounter",,,Neurology
"S8410XD Injury of peroneal nerve at lower leg level, unspecified leg, subsequent encounter",,,Neurology
"S8410XS Injury of peroneal nerve at lower leg level, unspecified leg, sequela",,,Neurology
"S8411XA Injury of peroneal nerve at lower leg level, right leg, initial encounter",,,Neurology
"S8411XD Injury of peroneal nerve at lower leg level, right leg, subsequent encounter",,,Neurology
"S8411XS Injury of peroneal nerve at lower leg level, right leg, sequela",,,Neurology
"S8412XA Injury of peroneal nerve at lower leg level, left leg, initial encounter",,,Neurology
"S8412XD Injury of peroneal nerve at lower leg level, left leg, subsequent encounter",,,Neurology
"S8412XS Injury of peroneal nerve at lower leg level, left leg, sequela",,,Neurology
"S8420XA Injury of cutaneous sensory nerve at lower leg level, unspecified leg, initial encounter",,,Neurology
"S8420XD Injury of cutaneous sensory nerve at lower leg level, unspecified leg, subsequent encounter",,,Neurology
"S8420XS Injury of cutaneous sensory nerve at lower leg level, unspecified leg, sequela",,,Neurology
"S8421XA Injury of cutaneous sensory nerve at lower leg level, right leg, initial encounter",,,Neurology
"S8421XD Injury of cutaneous sensory nerve at lower leg level, right leg, subsequent encounter",,,Neurology
"S8421XS Injury of cutaneous sensory nerve at lower leg level, right leg, sequela",,,Neurology
"S8422XA Injury of cutaneous sensory nerve at lower leg level, left leg, initial encounter",,,Neurology
"S8422XD Injury of cutaneous sensory nerve at lower leg level, left leg, subsequent encounter",,,Neurology
"S8422XS Injury of cutaneous sensory nerve at lower leg level, left leg, sequela",,,Neurology
"S8490XA Injury of unspecified nerve at lower leg level, unspecified leg, initial encounter",,,Neurology
"S8490XD Injury of unspecified nerve at lower leg level, unspecified leg, subsequent encounter",,,Neurology
"S8490XS Injury of unspecified nerve at lower leg level, unspecified leg, sequela",,,Neurology
"S8491XA Injury of unspecified nerve at lower leg level, right leg, initial encounter",,,Neurology
"S8491XD Injury of unspecified nerve at lower leg level, right leg, subsequent encounter",,,Neurology
"S8491XS Injury of unspecified nerve at lower leg level, right leg, sequela",,,Neurology
"S8492XA Injury of unspecified nerve at lower leg level, left leg, initial encounter",,,Neurology
"S8492XD Injury of unspecified nerve at lower leg level, left leg, subsequent encounter",,,Neurology
"S8492XS Injury of unspecified nerve at lower leg level, left leg, sequela",,,Neurology
"S9400XA Injury of lateral plantar nerve, unspecified leg, initial encounter",,,Neurology
"S9400XD Injury of lateral plantar nerve, unspecified leg, subsequent encounter",,,Neurology
"S9400XS Injury of lateral plantar nerve, unspecified leg, sequela",,,Neurology
"S9401XA Injury of lateral plantar nerve, right leg, initial encounter",,,Neurology
"S9401XD Injury of lateral plantar nerve, right leg, subsequent encounter",,,Neurology
"S9401XS Injury of lateral plantar nerve, right leg, sequela",,,Neurology
"S9402XA Injury of lateral plantar nerve, left leg, initial encounter",,,Neurology
"S9402XD Injury of lateral plantar nerve, left leg, subsequent encounter",,,Neurology
"S9402XS Injury of lateral plantar nerve, left leg, sequela",,,Neurology
"S9410XA Injury of medial plantar nerve, unspecified leg, initial encounter",,,Neurology
"S9410XD Injury of medial plantar nerve, unspecified leg, subsequent encounter",,,Neurology
"S9410XS Injury of medial plantar nerve, unspecified leg, sequela",,,Neurology
"S9411XA Injury of medial plantar nerve, right leg, initial encounter",,,Neurology
"S9411XD Injury of medial plantar nerve, right leg, subsequent encounter",,,Neurology
"S9411XS Injury of medial plantar nerve, right leg, sequela",,,Neurology
"S9412XA Injury of medial plantar nerve, left leg, initial encounter",,,Neurology
"S9412XD Injury of medial plantar nerve, left leg, subsequent encounter",,,Neurology
"S9412XS Injury of medial plantar nerve, left leg, sequela",,,Neurology
"S9420XA Injury of deep peroneal nerve at ankle and foot level, unspecified leg, initial encounter",,,Neurology
"S9420XD Injury of deep peroneal nerve at ankle and foot level, unspecified leg, subsequent encounter",,,Neurology
"S9420XS Injury of deep peroneal nerve at ankle and foot level, unspecified leg, sequela",,,Neurology
"S9421XA Injury of deep peroneal nerve at ankle and foot level, right leg, initial encounter",,,Neurology
"S9421XD Injury of deep peroneal nerve at ankle and foot level, right leg, subsequent encounter",,,Neurology
"S9421XS Injury of deep peroneal nerve at ankle and foot level, right leg, sequela",,,Neurology
"S9422XA Injury of deep peroneal nerve at ankle and foot level, left leg, initial encounter",,,Neurology
"S9422XD Injury of deep peroneal nerve at ankle and foot level, left leg, subsequent encounter",,,Neurology
"S9422XS Injury of deep peroneal nerve at ankle and foot level, left leg, sequela",,,Neurology
"S9430XA Injury of cutaneous sensory nerve at ankle and foot level, unspecified leg, initial encounter",,,Neurology
"S9430XD Injury of cutaneous sensory nerve at ankle and foot level, unspecified leg, subsequent
encounter",,,Neurology
"S9430XS Injury of cutaneous sensory nerve at ankle and foot level, unspecified leg, sequela",,,Neurology
"S9431XA Injury of cutaneous sensory nerve at ankle and foot level, right leg, initial encounter",,,Neurology
"S9431XD Injury of cutaneous sensory nerve at ankle and foot level, right leg, subsequent encounter",,,Neurology
"S9431XS Injury of cutaneous sensory nerve at ankle and foot level, right leg, sequela",,,Neurology
"S9432XA Injury of cutaneous sensory nerve at ankle and foot level, left leg, initial encounter",,,Neurology
"S9432XD Injury of cutaneous sensory nerve at ankle and foot level, left leg, subsequent encounter",,,Neurology
"S9432XS Injury of cutaneous sensory nerve at ankle and foot level, left leg, sequela",,,Neurology
"S9490XA Injury of unspecified nerve at ankle and foot level, unspecified leg, initial encounter",,,Neurology
"S9490XD Injury of unspecified nerve at ankle and foot level, unspecified leg, subsequent encounter",,,Neurology
"S9490XS Injury of unspecified nerve at ankle and foot level, unspecified leg, sequela",,,Neurology
"S9491XA Injury of unspecified nerve at ankle and foot level, right leg, initial encounter",,,Neurology
"S9491XD Injury of unspecified nerve at ankle and foot level, right leg, subsequent encounter",,,Neurology
"S9491XS Injury of unspecified nerve at ankle and foot level, right leg, sequela",,,Neurology
"S9492XA Injury of unspecified nerve at ankle and foot level, left leg, initial encounter",,,Neurology
"S9492XD Injury of unspecified nerve at ankle and foot level, left leg, subsequent encounter",,,Neurology
"S9492XS Injury of unspecified nerve at ankle and foot level, left leg, sequela",,,Neurology
"T85110A Breakdown (mechanical) of implanted electronic neurostimulator of brain electrode (lead),
initial encounter",,,Neurology
"T85110D Breakdown (mechanical) of implanted electronic neurostimulator of brain electrode (lead),
subsequent encounter",,,Neurology
"T85110S Breakdown (mechanical) of implanted electronic neurostimulator of brain electrode (lead),
sequela",,,Neurology
"T85111A Breakdown (mechanical) of implanted electronic neurostimulator of peripheral nerve
electrode (lead), initial encounter",,,Neurology
"T85111D Breakdown (mechanical) of implanted electronic neurostimulator of peripheral nerve
electrode (lead), subsequent encounter",,,Neurology
"T85111S Breakdown (mechanical) of implanted electronic neurostimulator of peripheral nerve electrode
(lead), sequela",,,Neurology
"T85120A Displacement of implanted electronic neurostimulator of brain electrode (lead), initial
encounter",,,Neurology
"T85120D Displacement of implanted electronic neurostimulator of brain electrode (lead), subsequent
encounter",,,Neurology
"T85120S Displacement of implanted electronic neurostimulator of brain electrode (lead), sequela",,,Neurology
"T85121A Displacement of implanted electronic neurostimulator of peripheral nerve electrode (lead),
initial encounter",,,Neurology
"T85121D Displacement of implanted electronic neurostimulator of peripheral nerve electrode (lead),
subsequent encounter",,,Neurology
"T85121S Displacement of implanted electronic neurostimulator of peripheral nerve electrode (lead),
sequela",,,Neurology
"T85190A Other mechanical complication of implanted electronic neurostimulator of brain electrode
(lead), initial encounter",,,Neurology
"T85190D Other mechanical complication of implanted electronic neurostimulator of brain electrode
(lead), subsequent encounter",,,Neurology
"T85190S Other mechanical complication of implanted electronic neurostimulator of brain electrode
(lead), sequela",,,Neurology
"T85191A Other mechanical complication of implanted electronic neurostimulator of peripheral nerve
electrode (lead), initial encounter",,,Neurology
"T85191D Other mechanical complication of implanted electronic neurostimulator of peripheral nerve
electrode (lead), subsequent encounter",,,Neurology
"T85191S Other mechanical complication of implanted electronic neurostimulator of peripheral nerve
electrode (lead), sequela",,,Neurology
"T85731A Infection and inflammatory reaction due to implanted electronic neurostimulator of brain,
electrode (lead), initial encounter",,,Neurology
"T85731D Infection and inflammatory reaction due to implanted electronic neurostimulator of brain,
electrode (lead), subsequent encounter",,,Neurology
"T85731S Infection and inflammatory reaction due to implanted electronic neurostimulator of brain,
electrode (lead), sequela",,,Neurology
